Organization Name,Organization Name URL,Categories,Headquarters Location,Description,CB Rank (Company),Operating Status,Founded Date,Founded Date Precision
Airtel,https://www.crunchbase.com/organization/bharti-airtel-ltd,"Mobile, Public Relations, Telecommunications","New Delhi, Delhi, India","Airtel is a global telecommunications company that provides mobile, voice, and data solutions.",701,Active,1995-01-01,year
Cognizant,https://www.crunchbase.com/organization/cognizant-technology-solutions,"Consulting, Industrial Automation, Software","Teaneck, New Jersey, United States","Cognizant provides IT, consulting and BPO services.",702,Active,1994-01-26,day
SnapLogic,https://www.crunchbase.com/organization/snaplogic,"Cloud Computing, Cloud Data Services, Data Integration, Enterprise Software, Internet, SaaS","San Mateo, California, United States",SnapLogic is the leader in self-service application and data integration.,703,Active,2006-01-01,year
Puls,https://www.crunchbase.com/organization/cellsavers,"Android, Consumer, Consumer Electronics, iOS","San Francisco, California, United States","Puls provides rapid-response in-home repair and installation for smartphones and smart homes, through a network of skilled technicians.",704,Active,2015-01-01,year
Ethereum Foundation,https://www.crunchbase.com/organization/ethereum,"Application Performance Management, Blockchain, Consumer Applications, Developer APIs, Ethereum, Open Source","Bern, Bern, Switzerland",Ethereum is a platform and a programming language that helps developers to build and publish next-generation distributed applications.,705,Active,2014-07-06,day
ServiceTitan,https://www.crunchbase.com/organization/servicetitan,"Home Services, SaaS, Software","Glendale, California, United States",ServiceTitan is the service management software that helps leading home services businesses generate more leads and close more sales.,706,Active,2013-01-01,year
Signifyd,https://www.crunchbase.com/organization/signifyd,"Big Data, E-Commerce, Enterprise Software, FinTech, Payments","San Jose, California, United States","Signifyd is a SaaS-based, enterprise-grade fraud technology solution for e-commerce stores.",707,Active,2011-08-01,month
KKR & Co. (Kohlberg Kravis Roberts & Co.),https://www.crunchbase.com/organization/kkr,"Finance, Financial Services, Venture Capital","New York, New York, United States","KKR is a global alternative asset manager focusing on private equity, fixed income, and capital markets.",708,Active,1976-01-01,year
"Merck & Co., Inc.",https://www.crunchbase.com/organization/merck-co-inc,"Biotechnology, Health Care, Medical","Kenilworth, New Jersey, United States",Merck is a global healthcare leader working to help the world be well. Merck is known as MSD outside the United States and Canada.,709,Active,1891-01-01,year
Earnin,https://www.crunchbase.com/organization/activehours,"Financial Services, FinTech, Mobile Payments","Palo Alto, California, United States","Earnin gives people access to their pay directly from their smartphones, whenever they need it",710,Active,2012-01-01,year
MediaMath,https://www.crunchbase.com/organization/mediamath,"Advertising, Digital Media, Internet, Marketing, Software","New York, New York, United States",MediaMath develops and delivers digital advertising media and data management technology solutions to advertisers worldwide.,711,Active,2007-08-01,month
Holmusk,https://www.crunchbase.com/organization/holmusk,"Analytics, Artificial Intelligence, Big Data, Health Care, Information Technology, Medical, mHealth, Personal Health","Singapore, Central Region, Singapore",Holmusk is a digital health company providing solutions for complex problems through innovative and scalable behavioural change programmes. ,712,Active,2015-01-01,year
Team8,https://www.crunchbase.com/organization/team8,"Computer, Cyber Security, Network Security","Tel Aviv-yafo, Tel Aviv, Israel",Team8 is a cybersecurity think tank and venture creation foundry.,713,Active,2014-01-01,year
FLIR Systems,https://www.crunchbase.com/organization/flir-systems,"Hardware, Manufacturing, Security, Software","Wilsonville, Oregon, United States","FLIR Systems designs, manufactures, and markets technology solutions that focus on thermal imaging and infrared camera systems.",714,Active,1978-01-01,year
Stanza Living,https://www.crunchbase.com/organization/stanza-living,"Hospitality, Information Technology, Travel Accommodations","New Delhi, Delhi, India",Stanza Living is a co-living platform created for students moving to a new place.,715,Active,2017-01-01,year
CureFit,https://www.crunchbase.com/organization/curefit,"Apps, Fitness, Health Care, Wellness","Bangalore, Karnataka, India","CureFit is an Indian health and fitness company offering digital and offline experiences across fitness, nutrition, and mental well-being.",716,Active,2016-07-01,day
Light,https://www.crunchbase.com/organization/light,"Consumer Electronics, E-Commerce, Internet, Photography, Software","Palo Alto, California, United States",Light combines revolutionary optics technology with an advanced image processing engine to make a camera that changes photography.,717,Active,2013-01-01,year
Xero,https://www.crunchbase.com/organization/xero,"Accounting, Banking, Billing, Collaboration, Finance, FinTech, Personal Finance, SaaS, Software","Wellington, Wellington, New Zealand","Xero is a suite of online accounting software for small businesses, accountants, and bookkeepers.",718,Active,2006-07-01,day
Stride Health,https://www.crunchbase.com/organization/stride-health,"Health Care, Health Insurance, Wellness","San Francisco, California, United States",Stride Health is a healthcare insurance-based platform that helps its users minimize their taxes and follow effective health plans.,719,Active,2013-01-01,year
Ucommune,https://www.crunchbase.com/organization/urwork,"Business Development, Business Information Systems, Business Intelligence, Coworking, Virtual Workforce","Beijing, Beijing, China",Ucommune offers co-working space solutions to small-to-medium enterprises.,720,Active,2015-01-01,year
PillPack,https://www.crunchbase.com/organization/pillpack,"Health Care, Hospital, Internet, Pharmaceutical","Boston, Massachusetts, United States",PillPack s a full-service pharmacy that sorts your medication by the dose and delivers to your door.,721,Active,2013-01-31,day
Leap Motion,https://www.crunchbase.com/organization/leap-motion,"Augmented Reality, Hardware, Software","San Francisco, California, United States",Leap Motion is a software and hardware company developing 3D motion-control technology for virtual reality and additional platforms.,722,Active,2010-10-01,day
Babylon Health,https://www.crunchbase.com/organization/babylon-health,"Artificial Intelligence, Health Care, Health Diagnostics, Home Health Care, Hospital, mHealth","London, England, United Kingdom",Babylon is making healthcare accessible and affordable for every person on Earth.,723,Active,2013-01-01,year
Kabbage,https://www.crunchbase.com/organization/kabbage,"Credit, Finance, FinTech, Lending","Atlanta, Georgia, United States","Kabbage offers fast, easy loans for small businesses.",724,Active,2009-02-12,day
SoundHound Inc.,https://www.crunchbase.com/organization/soundhound,"Artificial Intelligence, Audio, Mobile, Natural Language Processing, Speech Recognition","Santa Clara, California, United States",SoundHound Inc. is the leading innovator in voice-enabled AI and conversational intelligence technologies.,725,Active,2005-09-01,day
Morgan Stanley,https://www.crunchbase.com/organization/morgan-stanley,"Asset Management, Financial Services, Lending","New York, New York, United States","Morgan Stanley is an American financial services company that offers securities, asset management, and credit services.",726,Active,1935-01-01,year
Amazon,https://www.crunchbase.com/organization/amazon,"Business Development, Crowdsourcing, Delivery, Delivery Service, E-Commerce, Internet, Retail, SaaS, Shipping, Software","Seattle, Washington, United States","Amazon is an international e-commerce website for consumers, sellers, and content creators.",727,Active,1994-07-05,day
Away,https://www.crunchbase.com/organization/away-2,"Consumer, E-Commerce, Manufacturing, Travel","New York, New York, United States",Away is a brand designing thoughtful luggage for modern travel.,728,Active,2015-02-01,month
Bleacher Report,https://www.crunchbase.com/organization/bleacher-report,"Advertising, Digital Media, Publishing, Sports","San Francisco, California, United States","Bleacher Report is a digital media company based in America, delivering digital media content on sports around the world.",729,Active,2007-01-01,year
HackerRank,https://www.crunchbase.com/organization/hackerrank,"Employment, Recruiting, Skill Assessment","Palo Alto, California, United States",HackerRank is a technical hiring platform that helps businesses evaluate software developers based on skill.,730,Active,2012-07-01,day
Tumblr Inc.,https://www.crunchbase.com/organization/tumblr,"Blogging Platforms, Collaboration, Social Media, Social Network","New York, New York, United States","Tumblr, a microblogging platform and social networking website, enables users to post multimedia and other content to a short-form blog.",731,Active,2007-02-01,day
Hu-manity.co,https://www.crunchbase.com/organization/hu-manity-co,"Blockchain, Cryptocurrency, Humanitarian, Information Technology, Legal","Princeton, New Jersey, United States",Hu-manity.co is the world’s first and only organization developing decentralized human rights and corollary sovereign laws on blockchains.,732,Active,2018-04-02,day
ThreatMetrix,https://www.crunchbase.com/organization/threatmetrix,"Cyber Security, FinTech, Information Technology, Mobile, Security","San Jose, California, United States",ThreatMetrix is an integrated digital identity platform that allows its users to transact their businesses without friction.,733,Active,2005-01-01,year
Doctor On Demand,https://www.crunchbase.com/organization/doctor-on-demand,"Health Care, Hospital, Virtualization","San Francisco, California, United States","Doctor On Demand is a mobile app providing fast and easy access to some of the best doctors, psychologists, and other healthcare providers.",734,Active,2012-10-01,day
Formlabs,https://www.crunchbase.com/organization/formlabs,"3D Printing, Consumer Electronics, Hardware","Somerville, Massachusetts, United States",Formlabs develops powerful and accessible 3D printing systems designed for printing intricate figures.,735,Active,2011-01-01,year
rewardStyle,https://www.crunchbase.com/organization/rewardstyle,"Digital Media, Fashion, Internet, Retail","Dallas, Texas, United States",rewardStyle is an invitation-only content monetization platform that empowers thousands of premium digital lifestyle influencers,736,Active,2011-06-01,day
Figma,https://www.crunchbase.com/organization/figma,"Information Technology, Innovation Management, Internet","San Francisco, California, United States",The Collaborative Interface Design Tool,737,Active,2012-10-01,day
Konga Online Shopping,https://www.crunchbase.com/organization/konga-online-shopping-limited,"E-Commerce, Grocery, Internet, Mobile, Shopping","Lagos, Lagos, Nigeria","Konga Online Shopping is a Nigerian online shopping website selling books, home appliances, mobile phones, groceries, and others.",738,Active,2012-01-01,year
MySmartPrice,https://www.crunchbase.com/organization/mysmartprice,"E-Commerce, Internet, Price Comparison, Shopping","Hyderabad, Andhra Pradesh, India",MySmartPrice is an online research platform that lets users discover products across a wide array of categories that include mobiles.,739,Active,2011-08-10,day
Compare.com,https://www.crunchbase.com/organization/comparenow-com,"Auto Insurance, Automotive, Insurance, Price Comparison","Glen Allen, Virginia, United States","Real, unbiased car insurance quotes and side-by-side comparison help you find the best value on car insurance.",740,Active,2013-02-01,day
Kuaishou,https://www.crunchbase.com/organization/kuaishou,"Mobile Apps, Photo Sharing, Photography","Beijing, Beijing, China",Kuaishou is a platform for recording with millions of original fresh videos everyday.,741,Active,2011-01-01,year
Homeday,https://www.crunchbase.com/organization/homeday-2,"Commercial Real Estate, Real Estate, Real Estate Investment","Berlin, Berlin, Germany",Homeday is an online resource for finding a new home and getting in touch with a local realtor.,742,Active,2014-01-01,year
Giphy,https://www.crunchbase.com/organization/giphy,"Internet, Photo Sharing, Search Engine","New York, New York, United States","Giphy allows users to search, share, and discover best GIFs.",743,Active,2013-02-01,day
Vezeeta.com,https://www.crunchbase.com/organization/drbridge,"Health Care, Internet, Marketplace, Medical, PaaS, SaaS","Cairo, Al Qahirah, Egypt",Digital healthcare platform empowering consumers,744,Active,2012-01-01,year
Yellow,https://www.crunchbase.com/organization/yellow-d7ae,"Last Mile Transportation, Public Transportation, Ride Sharing, Transportation","São Paulo, Sao Paulo, Brazil",Yellow is an online micro-mobility platform that offers bike and e-scooter sharing services.,745,Active,2017-06-01,month
Datorama,https://www.crunchbase.com/organization/datorama,"Advertising, Analytics, Big Data, Marketing, SaaS, Software","New York, New York, United States",Datorama is a marketing intelligence platform that transforms the way marketers optimize their marketing performance.,746,Active,2012-07-01,day
University of Cambridge,https://www.crunchbase.com/organization/university-of-cambridge,"Education, Universities","Cambridge, Cambridgeshire, United Kingdom",The University of Cambridge is a public research university based in England and is one of the oldest universities in the world.,747,Active,1209-01-01,year
Digital Guardian,https://www.crunchbase.com/organization/digitalguardian,"Cyber Security, Data Visualization, Enterprise Software","Waltham, Massachusetts, United States",Advanced data protection solutions and managed services to secure sensitive data and assure the integrity of business processes.,748,Active,2003-01-01,year
EasyKnock,https://www.crunchbase.com/organization/easyknock,"Financial Services, Real Estate","New York, New York, United States","A residential real estate technology company helping homeowners tap their equity through their sale-leaseback program, Sell & Stay.",749,Active,2016-10-15,day
Domo,https://www.crunchbase.com/organization/domo,"Business Intelligence, Enterprise Software, SaaS, Software, Web Development","American Fork, Utah, United States",Domo designs and delivers an executive management platform as a service to help executives manage their business.,750,Active,2011-12-01,month
Quartet,https://www.crunchbase.com/organization/quartet-health,"Health Care, Information Technology, Predictive Analytics","New York, New York, United States","Quartet is a technology company improving behavioral health delivery for patients, providers, and payers.",751,Active,2014-01-01,year
Macquarie Group,https://www.crunchbase.com/organization/macquarie-group,"Banking, Finance, Financial Services","Sydney, New South Wales, Australia","Macquarie Group is a global provider of banking, financial, advisory, investment and funds management services.",752,Active,1969-01-01,year
Blippar,https://www.crunchbase.com/organization/blippar,"Advertising, Artificial Intelligence, Augmented Reality, Computer Vision, Education, Image Recognition, Marketing, Mobile, Software","London, England, United Kingdom","Blippar is a technology company specializing in augmented reality, artificial intelligence and computer vision.",753,Active,2011-08-17,day
Feedzai,https://www.crunchbase.com/organization/feedzai,"Analytics, Artificial Intelligence, Big Data, FinTech, Information Technology, Risk Management","San Mateo, California, United States","Feedzai is AI, with today’s most advanced risk management platform powered by artificial intelligence to make banking and commerce safe.",754,Active,2009-10-18,day
Healthkart,https://www.crunchbase.com/organization/healthkart,"E-Commerce, Fitness, Health Care","Gurgaon, Haryana, India","The one stop shop for health, fitness & beauty.",755,Active,2011-03-01,day
Cockroach Labs,https://www.crunchbase.com/organization/cockroach-labs,"Database, Enterprise Software, Open Source","New York, New York, United States","Cockroach Labs is the company behind CockroachDB, an open source, distributed SQL database. ",756,Active,2015-02-01,month
The RealReal,https://www.crunchbase.com/organization/the-realreal,"E-Commerce, Fashion, Lifestyle","San Francisco, California, United States",The RealReal is the leader in authenticated luxury consignment.,757,Active,2011-03-01,day
Stash,https://www.crunchbase.com/organization/stash-5,"Finance, Financial Services, FinTech, Personal Finance","New York, New York, United States",Stash is a New York-based digital investment platform.,758,Active,2015-02-19,day
Zola,https://www.crunchbase.com/organization/zola,"E-Commerce, Internet, Shopping, Wedding","New York, New York, United States","Zola is the fastest growing wedding company in the country, reinventing the wedding planning and registry experience.",759,Active,2013-01-01,year
Essential,https://www.crunchbase.com/organization/essential-2,"Consumer Electronics, Mobile Devices, Smart Home","Palo Alto, California, United States",Essential is a mobile and home devices company focused on creating consumer technology products for the 21st century.,760,Active,2017-01-01,year
Sense,https://www.crunchbase.com/organization/sense,"Consumer Electronics, GreenTech, Hardware, Internet of Things, Smart Home, Software, Speech Recognition","Cambridge, Massachusetts, United States",Sense is a home energy monitor that lets homeowners know what's on and how much energy each device uses in real-time.,761,Active,2013-02-01,month
Lookout,https://www.crunchbase.com/organization/lookout,"Cloud Security, Cyber Security, Enterprise Software, Mobile, Network Security, Security","San Francisco, California, United States",Lookout is a cybersecurity company that predicts and stops mobile attacks before harm is done to an individual or an enterprise.,762,Active,2007-01-01,year
Orbital Insight,https://www.crunchbase.com/organization/orbital-insight-inc,"Analytics, Big Data, Computer Vision, Geospatial, Machine Learning","Mountain View, California, United States",Orbital Insight builds a macroscope and finding truth and transparency in the ever-expanding supply of satellite images.,763,Active,2013-01-01,year
SentinelOne,https://www.crunchbase.com/organization/sentinel,"Computer, Cyber Security, Network Security, Security","Mountain View, California, United States",SentinelOne's next-generation endpoint protection combines behavioral-based detection with automatic mitigation and forensics.,764,Active,2013-01-01,year
Ritual,https://www.crunchbase.com/organization/ritual-3,"Apps, Coffee, Food and Beverage, Mobile","Toronto, Ontario, Canada",Ritual is an ordering app that taps a networks of co-workers & colleagues for fast & easy pick up & pay at local eateries and coffee shops.,765,Active,2014-01-01,year
Exabeam,https://www.crunchbase.com/organization/exabeam,"Cyber Security, Information Technology, Security","San Mateo, California, United States",Exabeam is a big data security analytics company that is changes the way cyberattacks are detected and simplifying security operations.,766,Active,2013-01-01,year
Alan,https://www.crunchbase.com/organization/alan-3,"Health Care, Health Insurance, Life Insurance","Paris, Ile-de-France, France",Alan is a digital health insurance platform with a focus on user experience with an excellent price-quality ratio health plan.,767,Active,2016-02-01,month
Imbellus,https://www.crunchbase.com/organization/imbellus,"Analytics, Human Computer Interaction, Software","Los Angeles, California, United States",Imbellus reinvents how to measure human potential.,768,Active,2015-01-01,year
Chegg,https://www.crunchbase.com/organization/chegg,"E-Commerce, Education, Higher Education, Textbook","Santa Clara, California, United States",Chegg is an online textbook rental company offering services to universities and community colleges in the U.S.,769,Active,2007-01-01,year
Creative Destruction Lab,https://www.crunchbase.com/organization/creative-destruction-lab,"Advice, Angel Investment, Finance, Quantum Computing, Venture Capital","Toronto, Ontario, Canada","A seed-stage program for massively scalable, science- and technology-based ventures.",770,Active,2012-08-01,day
Freebird,https://www.crunchbase.com/organization/freebird,"Leisure, Tourism, Transportation, Travel","Cambridge, Massachusetts, United States",Freebird empowers travelers to book a new ticket – on any airline at no additional cost – in the event of a flight cancellation or delay.,771,Active,2015-01-01,year
WireWheel.io,https://www.crunchbase.com/organization/wirewheel-io,"Compliance, Cyber Security, Privacy","Arlington, Virginia, United States",WireWheel.io is a software company that revolutionizes data privacy and protection as-a-service for companies.,772,Active,2016-12-22,day
Telefonica,https://www.crunchbase.com/organization/telefonica,"Internet, Public Relations, Telecommunications, TV, Web Development, Web Hosting","Madrid, Madrid, Spain",Telefonica is a diversified telecommunications group that provides fixed line and mobile telephony services.,773,Active,1924-01-01,year
Zynga,https://www.crunchbase.com/organization/zynga,"Gaming, Mobile, PC Games","San Francisco, California, United States","Zynga develops, markets, and operates social games as live services played on the Internet.",774,Active,2007-04-01,day
Just Eat,https://www.crunchbase.com/organization/just-eat-com,"E-Commerce, Food and Beverage, Food Delivery, Internet","London, England, United Kingdom",Just Eat provides convenient and easy access to a huge variety of delivery restaurants and order food online.,775,Active,2001-01-01,year
Convene,https://www.crunchbase.com/organization/convene,"Enterprise Software, Events, Information Technology, Meeting Software","New York, New York, United States",Convene is a conference and meeting network that helps its users organize effective conferences with technological support.,776,Active,2009-11-01,day
Becton Dickinson,https://www.crunchbase.com/organization/becton-dickinson,"Biotechnology, Health Care, Medical, Medical Device","Franklin Lakes, New Jersey, United States","BD is a medical technology company that serves healthcare institutions, life science researchers, clinical laboratories and the industry.",777,Active,1897-01-01,year
SkipTheDishes,https://www.crunchbase.com/organization/skipthedishes,"E-Commerce, Logistics, Restaurants, Software","Winnipeg, Manitoba, Canada",SkipTheDishes connects hungry people with restaurants and local Food Couriers through our proprietary algorithm-based dispatch system.,778,Active,2013-01-01,year
British Telecom Group (BT Group),https://www.crunchbase.com/organization/bt,"Information Technology, Internet, Telecommunications, Web Hosting","London, England, United Kingdom",BT provides communications services to consumer and business sectors worldwide.,779,Active,1980-10-01,day
TenantCloud,https://www.crunchbase.com/organization/tenantcloud-2,"Accounting, Building Maintenance, Financial Services, Lending, Mobile, Mobile Payments, Property Management, Real Estate, Real Estate Investment, Task Management","Austin, Texas, United States",On-demand ServicePros for Landlords,780,Active,2014-11-01,day
CallRail,https://www.crunchbase.com/organization/callrail,"Advertising, Analytics, Business Intelligence, Small and Medium Businesses","Atlanta, Georgia, United States",CallRail is a phone call tracking and analytics platform businesses use to understand which marketing campaigns drive leads and conversions.,781,Active,2011-03-01,day
Wellcome Trust,https://www.crunchbase.com/organization/wellcome-trust,"Biotechnology, Health Care, Medical, Non Profit","London, England, United Kingdom",The Wellcome Trust is a British biomedical research charity.,782,Active,1936-01-01,year
Juniper Networks,https://www.crunchbase.com/organization/juniper-networks,"Communication Hardware, Infrastructure, Security","Sunnyvale, California, United States","Juniper Networks is a news network that designs, develops, and sells products and services, along with network infrastructure.",783,Active,1996-02-06,day
Rylo,https://www.crunchbase.com/organization/rylo,"Consumer Electronics, Hardware, Photography, Software, Video, Video Editing","San Francisco, California, United States",Rylo is a consumer electronic company that is behind of a powerful little 360° camera that shoots larger-than-life video.,784,Active,2015-06-01,month
Meituan.com,https://www.crunchbase.com/organization/meituan-com,"Consumer, E-Commerce, Group Buying, Internet","Beijing, Beijing, China","Meituan.com is a group-buying website specializing in localized consumer services, offering a selection of local restaurants, bars and more.",785,Active,2010-03-04,day
Cox Enterprises,https://www.crunchbase.com/organization/cox-enterprises,"Broadcasting, Digital Media, Software","Atlanta, Georgia, United States","Cox Enterprises is a communications, media and automotive services company.",786,Active,1898-01-01,year
Spiceworks,https://www.crunchbase.com/organization/spiceworks,Internet,"Austin, Texas, United States","Spiceworks is the marketplace that connects the IT industry to help tech buyers and sellers get their jobs done, every day.",787,Active,2006-01-02,day
Drive.ai,https://www.crunchbase.com/organization/drive-ai,"Artificial Intelligence, Automotive, Autonomous Vehicles, Machine Learning, Robotics, Software","Mountain View, California, United States",Drive.ai creates AI software for autonomous vehicles.,788,Active,2015-01-01,year
