Organization Name,Organization Name URL,Categories,Headquarters Location,Description,CB Rank (Company),Operating Status,Founded Date,Founded Date Precision
Teikametrics,https://www.crunchbase.com/organization/teikametrics,E-Commerce,"Boston, Massachusetts, United States",Teikametrics is a dynamic ecommerce optimization platform for retailers on Amazon and other marketplaces.,527,Active,2012-07-01,day
SeatGeek,https://www.crunchbase.com/organization/seatgeek,"Concerts, Ediscovery, Events, Search Engine, Sports, Ticketing, Vertical Search","New York, New York, United States","SeatGeek is a ticket search engine that aggregates ticket listings for live sports, concerts, and theater events.",528,Active,2009-01-01,year
Apptio,https://www.crunchbase.com/organization/apptio,"Enterprise Software, Information Technology, SaaS","Bellevue, Washington, United States",Apptio is a provider of SaaS-based Technology Business Management (TBM) solutions for managing businesses in the IT field.,529,Active,2007-11-01,day
Privateer Holdings,https://www.crunchbase.com/organization/privateer-holdings,"Cannabis, Finance, Financial Services, Venture Capital","Seattle, Washington, United States",Privateer Holdings is a private equity firm shaping the future of legal cannabis.,530,Active,2011-01-01,year
Smartfrog,https://www.crunchbase.com/organization/smartfrog-com,"Enterprise Software, Home Services, Internet, Internet of Things, Software","Dublin, Dublin, Ireland","Smartfrog provides a home surveillance solution that includes an application (Android and iOS), a camera, and video storage features.",531,Active,2014-01-01,year
Snowflake Computing,https://www.crunchbase.com/organization/snowflake-computing,"Analytics, Cloud Data Services, Enterprise Software, SaaS, Software","San Mateo, California, United States",Snowflake provides a data warehouse as a service designed for the cloud.,532,Active,2012-01-01,year
Bloom & Wild,https://www.crunchbase.com/organization/bloom-wild,"E-Commerce, Gift, Interior Design","London, England, United Kingdom","Using technology, brand and logistics to build the world's leading and most loved flower gifting company.",533,Active,2013-01-01,year
Tokopedia,https://www.crunchbase.com/organization/tokopedia,"E-Commerce, Internet, Marketplace, Shopping","Jakarta, Jakarta Raya, Indonesia",Tokopedia is an online marketplace that allows individuals and business owners in Indonesia to open and maintain their stores for free.,534,Active,2009-02-06,day
TELUS,https://www.crunchbase.com/organization/telus,"Analytics, Internet, Mobile, Wireless","Vancouver, British Columbia, Canada","Second largest Canadian telecommunications company. Provides wireless phone service, high speed Internet, IPTV, home phone, long distance,",535,Active,1990-01-01,year
Kite Pharma,https://www.crunchbase.com/organization/kite-pharma,"Biotechnology, Health Care, Medical","Los Angeles, California, United States",Kite Pharma is a development-stage biotechnology company designing and developing immune-based therapies to treat cancer indications..,536,Active,2009-01-01,year
LAIX LingoChamp (Liulishuo),https://www.crunchbase.com/organization/liulishuo,"Apps, Education, Language Learning","Shanghai, Shanghai, China","Through cutting-edge AI technology & innovative product design, we help users learn English more efficiently and communicate with the world.",537,Active,2012-01-01,year
InVisionApp,https://www.crunchbase.com/organization/invisionapp,"Apps, Collaboration, Internet, Mobile, Product Design, SaaS, UX Design","New York, New York, United States","InVisionApp provides a design collaboration platform for startups, corporations and design agencies. ",538,Active,2011-01-01,year
Spin,https://www.crunchbase.com/organization/skinny-labs-inc,"Apps, Last Mile Transportation, Mobile Apps, Transportation","San Francisco, California, United States",Spin is a stationless electric scooter company that provides dockless mobility systems.,539,Active,2016-11-01,day
Veem,https://www.crunchbase.com/organization/goveem,"Bitcoin, FinTech, Information Technology, Payments","San Francisco, California, United States",Veem is a next generation payment service provider (PSP) for global commerce. ,540,Active,2014-02-01,day
Zerto,https://www.crunchbase.com/organization/zerto,"Cloud Computing, Computer, Enterprise Software, Private Cloud, Software, Virtualization","Boston, Massachusetts, United States",Zerto provides enterprise-class business continuity and disaster recovery (BCDR) solutions for virtualized infrastructure and the cloud.,541,Active,2009-01-01,year
Airbnb,https://www.crunchbase.com/organization/airbnb,"Hospitality, Marketplace, Peer to Peer, Sharing Economy, Travel, Travel Accommodations","San Francisco, California, United States","Airbnb is an online community marketplace for people to list, discover, and book accommodations around the world.",542,Active,2008-08-11,day
Coupa Software,https://www.crunchbase.com/organization/coupa,"Cloud Computing, Cloud Infrastructure, Enterprise Software, Finance, Procurement, SaaS","San Mateo, California, United States",Coupa is a cloud platform for business spend that offers a fully unified suite of financial applications for business spend management.,543,Active,2006-01-01,year
Ximalaya FM,https://www.crunchbase.com/organization/ximalaya,"Audio, Internet Radio, Mobile","Shanghai, Shanghai, China",Ximalaya is a service website that enables users to share audio and personal radio stations.,544,Active,2012-08-01,day
iguazio,https://www.crunchbase.com/organization/iguaz-io,"Analytics, Artificial Intelligence, Big Data, Cloud Data Services, Internet of Things, Machine Learning, PaaS, Real Time, Software","Herzliya, Tel Aviv, Israel","iguazio's Continuous Analytics Data Platform has redesigned the data stack to accelerate performance in big data, IoT and cloud-native apps.",545,Active,2014-01-01,year
CloudBees,https://www.crunchbase.com/organization/cloudbees,"Cloud Computing, Enterprise Software, Software","San Jose, California, United States","CloudBees offers CloudBees Jenkins Enterprise, an enterprise-grade continuous delivery platform powered by Jenkins.",546,Active,2010-03-09,day
Okta,https://www.crunchbase.com/organization/okta,"Enterprise, Enterprise Software, Identity Management, Security","San Francisco, California, United States",Okta is the leading independent provider of identity for the enterprise.,547,Active,2009-01-01,day
Oxford Nanopore Technologies,https://www.crunchbase.com/organization/oxford-nanopore-technologies,"Biopharma, Biotechnology, Genetics, Health Diagnostics, Nanotechnology","Oxford, Oxfordshire, United Kingdom","Oxford Nanopore Technologies develops nanopore-based electronic systems for analyzing single molecules, including DNA, RNA and proteins.",548,Active,2005-01-01,year
Carta,https://www.crunchbase.com/organization/eshares,"Enterprise Software, Finance, FinTech, Internet","Palo Alto, California, United States","Carta is building the global ownership management platform, and helps companies, investors, and employees manage equity.",549,Active,2012-01-01,year
Databricks,https://www.crunchbase.com/organization/databricks,"Analytics, Enterprise Software, Open Source","San Francisco, California, United States","Databricks accelerates innovation by unifying analytics across data science, data engineering, and the business.",550,Active,2013-01-01,year
Crux Informatics,https://www.crunchbase.com/organization/crux-informatics,"Financial Services, Insurance, Machine Learning","San Francisco, California, United States",Crux Informatics offers an informatics platform and secure cloud service help firms focus on what really matters.,551,Active,2017-01-01,year
K4Connect,https://www.crunchbase.com/organization/k4connect,"Software, Web Development","Raleigh, North Carolina, United States","Serving older adults & those living w disabilities via our integrated Technology Delivery Platform; making life simpler, healthier, happier",552,Active,2013-10-01,month
CybelAngel,https://www.crunchbase.com/organization/cybelangel,"Artificial Intelligence, Cyber Security, Machine Learning, Real Time, SaaS, Security","Paris, Ile-de-France, France",CybelAngel is a leading digital risk management platform providing enterprises with actionable threat intelligence.,553,Active,2013-02-13,day
TransferWise,https://www.crunchbase.com/organization/transferwise,"Finance, Financial Services, FinTech, Payments, Peer to Peer","London, England, United Kingdom",TransferWise is a money transfer service allowing private individuals and businesses to send money abroad without hidden charges.,554,Active,2010-03-01,day
TidalScale,https://www.crunchbase.com/organization/tidalscale,"Analytics, Data Mining, Software","Campbell, California, United States","TidalScale Result – faster, simpler, cheaper development. Scale your compute to match the problem, rather than the problem to the compute.",555,Active,2013-01-01,day
data.world,https://www.crunchbase.com/organization/data-world,"Analytics, Cloud Data Services, Collaboration, Database, SaaS","Austin, Texas, United States","data.world's Smart Data Catalog wakes up the hidden data workforce within every enterprise, unifies silos, and creates data cultures faster.",556,Active,2015-01-01,year
MapR Technologies,https://www.crunchbase.com/organization/mapr-technologies,"Analytics, Big Data, Cloud Computing, Enterprise Software, Open Source, Software","Santa Clara, California, United States",MapR Technologies is the industry’s leading data platform for AI and Analytics.,557,Active,2009-01-01,year
Springbot,https://www.crunchbase.com/organization/springbot,"Analytics, Artificial Intelligence, Big Data, E-Commerce, Email Marketing, Marketing Automation, Marketplace, SaaS, Social Media Marketing","Atlanta, Georgia, United States","Springbot delivers data-driven marketing recommendations, marketing automation, and analytics in one dynamic platform for SMB merchants.",558,Active,2012-01-01,year
Element AI,https://www.crunchbase.com/organization/element-ai,"Artificial Intelligence, Consulting, Machine Learning","Montréal, Quebec, Canada",Element AI is an artificial intelligence solutions provider.,559,Active,2016-10-25,day
Fidelis Cybersecurity,https://www.crunchbase.com/organization/fidelis-cybersecurity-2,"Cloud Security, Cyber Security, Enterprise Software, Network Security, Security","Bethesda, Maryland, United States","Fidelis Cybersecurity automates deception, detection and response across network, endpoint and cloud environments.",560,Active,2002-01-01,year
Coople,https://www.crunchbase.com/organization/staff-finder,"Employment, Human Resources, Marketplace, Recruiting","Zürich, Zurich, Switzerland",Coople is a leading marketplace for on-demand work and the simplest link between employee and employer. ,561,Active,2009-01-01,year
Featurespace,https://www.crunchbase.com/organization/featurespace,"Artificial Intelligence, Banking, FinTech, Fraud Detection, Payments, Software","Cambridge, Cambridgeshire, United Kingdom",Featurespace is a UK-based provider of adaptive behavioral analytics technology for fraud and risk management in financial services & gaming,562,Active,2008-01-01,year
Motorola Solutions,https://www.crunchbase.com/organization/motorola-solutions,"Communications Infrastructure, Cyber Security, Electronics, Information Technology, Mobile, Public Safety, Telecommunications, Wireless","Schaumburg, Illinois, United States",Motorola Solutions creates mission-critical communication solutions and services for public safety and commercial customers.,563,Active,1928-09-25,day
Riskified,https://www.crunchbase.com/organization/riskified,"E-Commerce, FinTech, Fraud Detection, Machine Learning, Risk Management","Tel Aviv, Tel Aviv, Israel",Riskified is an all-in-one eCommerce fraud prevention solution and chargeback protection service for high volume and enterprise merchants.,564,Active,2012-01-01,year
Stay Alfred,https://www.crunchbase.com/organization/stay-alfred,"Hospitality, Rental, Vacation Rental","Spokane, Washington, United States",Stay Alfred offers hotel-style accommodations in high-end downtown apartment buildings in downtown locations.,565,Active,2010-01-01,year
Sensor Tower,https://www.crunchbase.com/organization/sensor-tower,"Analytics, Android, Big Data, iOS, Market Research, Mobile, Mobile Apps","San Francisco, California, United States",Sensor Tower equips publishers and marketers with the data and insights needed to master the mobile app ecosystem.,566,Active,2013-01-01,year
Workday,https://www.crunchbase.com/organization/workday,"Enterprise Software, Finance, FinTech, Human Resources, SaaS, Web Development","Pleasanton, California, United States",Workday provides SaaS-based enterprise solutions for a company's human resources and financial management activities.,567,Active,2005-03-01,day
DataStax,https://www.crunchbase.com/organization/datastax,"Big Data, Database, Enterprise, Enterprise Software, Software","Santa Clara, California, United States",DataStax is the leader in data management for cloud applications.,568,Active,2010-03-31,day
Cumulus Networks,https://www.crunchbase.com/organization/cumulus-networks,"Cloud Computing, Linux, Web Hosting","Mountain View, California, United States","Cumulus Networks, a software company, designs, and sells Linux operating systems for networking hardware.",569,Active,2010-01-01,year
Accenture,https://www.crunchbase.com/organization/accenture,"Construction, Consulting, Information Technology, Outsourcing","Dublin, Dublin, Ireland","Accenture is a global management consulting firm that offers a range of services & solutions in strategy, consulting, tech and operations. ",570,Active,1989-01-01,year
Wealthsimple,https://www.crunchbase.com/organization/wealthsimple,"Finance, Financial Services, Impact Investing","Toronto, Ontario, Canada","Wealthsimple is a new kind of financial advisor — one that's intuitive, affordable, and human",571,Active,2014-01-01,year
Alnylam Pharmaceuticals,https://www.crunchbase.com/organization/alnylam-pharmaceuticals,"Biotechnology, Health Care, Medical","Cambridge, Massachusetts, United States",Alnylam Pharmaceuticals develops novel therapeutics-based RNAi and provides overviews of recent drug development programs.,572,Active,2002-01-01,year
Setter,https://www.crunchbase.com/organization/setter,"Building Maintenance, Home Services, Information Services, Information Technology, Smart Home","Toronto, Ontario, Canada",Setter is a Home Service that takes care of all your home maintenance and repairs.,573,Active,2015-01-01,year
Orchard Therapeutics,https://www.crunchbase.com/organization/orchard-therapeutics,"Biotechnology, Genetics, Health Care, Health Diagnostics","London, England, United Kingdom",Orchard Therapeutics is a biotechnology company dedicated to transforming the lives of patients through innovative gene therapies.,574,Active,2015-01-01,year
Zimperium,https://www.crunchbase.com/organization/zimperium,"Apps, Enterprise Software, Machine Learning, Mobile, Network Security, Security","San Francisco, California, United States",ZIMPERIUM is a mobile security startup that offers protection for mobile devices against the next generation of advanced mobile attacks.,575,Active,2010-08-01,day
Bluecore,https://www.crunchbase.com/organization/triggermail,"Advertising, Brand Marketing, Email Marketing, Marketing Automation, Software","New York, New York, United States",Bluecore is building the future of ecommerce marketing through data and automation,576,Active,2013-01-06,day
WP Engine,https://www.crunchbase.com/organization/wp-engine,"Blogging Platforms, Content, Enterprise Software, Web Development, Web Hosting","Austin, Texas, United States",WP Engine is a WordPress digital experience platform.,577,Active,2010-03-01,day
Angie's List,https://www.crunchbase.com/organization/angies-list,"Advertising, E-Commerce, Local","Indianapolis, Indiana, United States",Angie’s List provides trusted reviews and information to help millions of consumers make hiring decisions in hundreds of service categories.,578,Active,1995-01-01,year
Tamr,https://www.crunchbase.com/organization/tamr,"Data Integration, Database, Enterprise Software, Machine Learning","Cambridge, Massachusetts, United States","Tamr is an enterprise data unification company that is cost-effective, scalable, and accessible to any enterprise.",579,Active,2012-01-01,year
Peloton Technology,https://www.crunchbase.com/organization/peloton-technology,"Automotive, Fleet Management, Robotics, Transportation","Mountain View, California, United States",Peloton is a connected and automated vehicle technology company improving safety and efficiency in the trucking industry.,580,Active,2011-01-01,year
Toast,https://www.crunchbase.com/organization/toast,"Analytics, Mobile, Point of Sale, Restaurants","Boston, Massachusetts, United States",Toast is an all-in-one point-of-sale and restaurant management platform for businesses in the food service and hospitality space.,581,Active,2011-12-22,day
Fair,https://www.crunchbase.com/organization/fair,"Automotive, Financial Services, FinTech","Santa Monica, California, United States","Fair is a Santa Monica, CA-based car leasing company.",582,Active,2016-01-01,year
PayJoy,https://www.crunchbase.com/organization/payjoy,"Credit, Emerging Markets, Financial Services, FinTech, Mobile, SaaS, Software","San Francisco, California, United States",PayJoy provides smartphone-enabled consumer financing solutions.,583,Active,2015-01-01,year
Shipwell,https://www.crunchbase.com/organization/shipwell,"Analytics, B2B, Big Data, Information Technology, Logistics, Machine Learning, Supply Chain Management","Austin, Texas, United States",Shipwell is a freight trucking startup that provides business with automated way transport of goods and services.,584,Active,2016-01-01,year
Qonto,https://www.crunchbase.com/organization/qonto,"Banking, Financial Services, FinTech","Paris, Ile-de-France, France","We make business banking easy, efficient and transparent leveraging technology, elegant design and world-class customer support.",585,Active,2016-04-01,month
Huami,https://www.crunchbase.com/organization/huami,"Fitness, Health Care, Internet of Things, Lifestyle, Wearables, Wellness","Beijing, Beijing, China",Huami is the largest wearable device company worldwide with over 50 million units sold today and 17.1% global marketshare. ,586,Active,2014-01-01,month
Acquia,https://www.crunchbase.com/organization/acquia,"Computer, Content, Enterprise Software, Open Source","Boston, Massachusetts, United States","Global organizations turn to Acquia to provide technical expertise and strategic insight to build, deliver, and optimize the Drupal WCMS",587,Active,2007-05-01,day
Shipt,https://www.crunchbase.com/organization/shipt-2,"Delivery, E-Commerce, Grocery, Same Day Delivery","Birmingham, Alabama, United States",Shipt is a grocery delivery service that lets members order groceries and alcohol from their local store for delivery right to their door.,588,Active,2014-01-01,year
MakeMyTrip.com,https://www.crunchbase.com/organization/makemytrip-com,"Internet, Transportation, Travel","Gurgaon, Haryana, India","MakeMyTrip.com is an online travel company providing holiday packages, travel guides, and booking services for flights, hotels and buses.",589,Active,2000-01-01,year
GOAT,https://www.crunchbase.com/organization/goatapp,"E-Commerce, Fashion, Marketplace, Mobile","Culver City, California, United States",GOAT is a marketplace for buying and selling sneakers and streetwear.,590,Active,2015-01-01,year
Holachef,https://www.crunchbase.com/organization/holachef,"Delivery Service, Food Processing","Mumbai, Maharashtra, India",Holachef curates Chefs ranging from Executive Chefs to Amateurs .,591,Active,2014-01-01,year
FILLD,https://www.crunchbase.com/organization/filld,"Apps, Oil and Gas, Service Industry, Transportation","Mountain View, California, United States","Filld is a mobile refueling service, building a highly flexible, scalable, and fully mobile last mile infrastructure for vehicle refueling.",592,Active,2015-01-01,year
Etsy,https://www.crunchbase.com/organization/etsy,"E-Commerce, Marketplace, Sales","Brooklyn, New York, United States",Etsy is an e-commerce site and a smartphone application for buying and selling handmade and vintage items.,593,Active,2005-06-18,day
Loot Crate,https://www.crunchbase.com/organization/loot-crate,"Gaming, Media and Entertainment, Retail, Sports, Subscription Service","Los Angeles, California, United States",Loot Crate develops a fan-based commerce and community platform.,594,Active,2012-05-01,day
TravelTriangle,https://www.crunchbase.com/organization/traveltriangle-com,"E-Commerce, Personalization, Tourism, Travel","Charlottesville, Virginia, United States",TravelTriangle enables travel enthusiasts to reserve a personalized holiday plan with a local travel agent.,595,Active,2011-07-01,day
Droom Technology Private Limited,https://www.crunchbase.com/organization/droom-technology-private-limited,"Automotive, E-Commerce Platforms, Marketplace","Gurgaon, Haryana, India",Droom is a marketplace for automobiles and automobile services.,596,Active,2014-06-17,day
News Corp.,https://www.crunchbase.com/organization/newscorporation,"Education, Information Services, Internet, News, Publishing","New York, New York, United States","News Corp. is a network of leading companies in the worlds of diversified media, news, education and information services.",597,Active,1979-01-01,year
Khan Academy,https://www.crunchbase.com/organization/khan-academy,"E-Learning, Education, Internet","Palo Alto, California, United States","Khan Academy provides a free world class education for anyone, anywhere.",598,Active,2006-01-01,year
Coursera,https://www.crunchbase.com/organization/coursera,"EdTech, Education, Enterprise, Internet","Mountain View, California, United States",Coursera is an online education company that serves over 20 million learners from around the world.,599,Active,2012-01-01,year
App.io,https://www.crunchbase.com/organization/app-io,"Android, Customer Service, Enterprise Software, Internet, Mobile, SaaS","San Francisco, California, United States",App.io streams your mobile apps from the cloud to any device.,600,Active,2012-04-01,day
App Annie,https://www.crunchbase.com/organization/app-annie,"Analytics, Big Data, Mobile","San Francisco, California, United States",App Annie delivers data and insights to succeed in the app economy.,601,Active,2010-03-01,month
Wadi,https://www.crunchbase.com/organization/wadi,"Internet, Online Portals, Shopping","Dubai, Dubai, United Arab Emirates",Wadi.com is an online marketplace,602,Active,2015-01-01,year
Calm,https://www.crunchbase.com/organization/calm-com,"Leisure, Mobile, Personal Health","San Francisco, California, United States",Calm provides applications for individuals to relax their minds.,603,Active,2012-05-04,day
LivePerson,https://www.crunchbase.com/organization/liveperson,"Business Intelligence, Customer Service, Internet, Software","New York, New York, United States",LivePerson provides real-time intelligent customer engagement solutions that help companies enhance the relationship with their customers.,604,Active,1995-01-01,year
Glovo,https://www.crunchbase.com/organization/glovo-app,"Delivery, Local, Mobile, Transportation","Barcelona, Catalonia, Spain",Glovo allows customers to track their deliveries in real time and locate the nearest glover (courier).,605,Active,2015-03-01,day
One Medical,https://www.crunchbase.com/organization/one-medical-group,"Health Care, Information Technology, Medical, Medical Device","San Francisco, California, United States",One Medical is a members-only technology platform offering an array of concierge medical services.,606,Active,2007-01-01,year
Looker,https://www.crunchbase.com/organization/looker,"Analytics, Business Intelligence, Data Visualization, Enterprise Software","Santa Cruz, California, United States",Looker is a software company employing business intelligence to make data accessible to organizations and data analysts.,607,Active,2011-01-01,year
Wealthfront,https://www.crunchbase.com/organization/wealthfront,"Finance, Financial Services, FinTech, Personal Finance, Stock Exchanges, Wealth Management","Redwood City, California, United States","The only automated financial advisor offering financial planning, investment management and banking-related services all on a mobile app.",608,Active,2011-01-01,year
Policybazaar,https://www.crunchbase.com/organization/policybazaar,"Auto Insurance, Commercial Insurance, Finance, Health Insurance, Internet, Life Insurance","Gurgaon, Haryana, India",Policybazaar is an insurance aggregator website that compares financial services from major insurance companies.,609,Active,2008-01-01,year
Arcadia Data,https://www.crunchbase.com/organization/arcadia-data,"Analytics, Big Data, Software","San Mateo, California, United States",Arcadia Data builds the industry’s only Unified Visual Analytics and BI Platform for big data.,610,Active,2012-01-01,year
Thomson Reuters,https://www.crunchbase.com/organization/thomson-reuters,"Analytics, FinTech, Risk Management","New York, New York, United States","Thomson Reuters delivers critical information from the financial, legal, accounting, intellectual property, science, and media markets.",611,Active,2008-04-17,day
Cargo,https://www.crunchbase.com/organization/cargo-3,"Apps, Logistics, Supply Chain Management, Transportation","New York, New York, United States",Cargo helps rideshare drivers earn more money and better ratings by providing products to passengers.,612,Active,2016-06-26,day
