Organization Name,Organization Name URL,Categories,Headquarters Location,Description,CB Rank (Company),Operating Status,Founded Date,Founded Date Precision
Netflix,https://www.crunchbase.com/organization/netflix,"Digital Entertainment, Media and Entertainment, TV, Video, Video Streaming","Los Gatos, California, United States","Netflix is an online platform that enables users to watch TV shows and movies on smart TVs, PCs, Macs, mobiles, tablets, and so on. ",1,Active,1997-01-01,day
Ant Financial,https://www.crunchbase.com/organization/alipay,"Banking, E-Commerce, Financial Services, FinTech, Payments, Wealth Management","Hangzhou, Zhejiang, China",Ant Financial is an online payment services provider that enables individuals and businesses to execute payments online in a secure manner.,2,Active,2014-10-01,month
Xiaomi,https://www.crunchbase.com/organization/xiaomi,"Consumer Electronics, Internet, Mobile","Beijing, Beijing, China",Xiaomi is an electronics and software company that focuses on mobile devices and technology.,3,Active,2010-04-04,day
Techstars,https://www.crunchbase.com/organization/techstars,"Finance, Financial Services, Venture Capital","Boulder, Colorado, United States",Techstars is the worldwide network that helps entrepreneurs succeed.,4,Active,2006-10-01,day
Tesla,https://www.crunchbase.com/organization/tesla-motors,"Automotive, Electronics, Innovation Management","Palo Alto, California, United States",Tesla Motors accelerates the transition to electric mobility with a full range of increasingly affordable electric cars.,5,Active,2003-01-01,day
Epic Games,https://www.crunchbase.com/organization/epic-games-2,"Developer Platform, Gaming, Video Games","Cary, North Carolina, United States",Epic Games is an American video game development company that creates games and offering its game engine technology to other developers.,6,Active,1991-01-01,year
Instagram,https://www.crunchbase.com/organization/instagram,"Mobile, Photo Sharing, Photography, Social Media","Menlo Park, California, United States","Instagram is a free photo sharing application that enables its users to take photos, apply filters, and share them on social networks.",7,Active,2010-10-06,day
NVIDIA,https://www.crunchbase.com/organization/nvidia,"GPU, Hardware, Software, Virtualization","Santa Clara, California, United States","NVIDIA manufactures integrated circuits for use in motherboard chip-sets, graphic processing units, and game consoles.",8,Active,1993-01-01,year
Go-Jek,https://www.crunchbase.com/organization/go-jek,"Apps, Delivery, Food Processing, Logistics, Payments, Same Day Delivery, Transportation","Jakarta, Jakarta Raya, Indonesia","Go-Jek specializes in ride-hailing, logistics, and digital payments.",9,Active,2010-10-12,day
Video++,https://www.crunchbase.com/organization/video-7010,"Media and Entertainment, Video, Video Editing, Video on Demand, Video Streaming","Shanghai, Shanghai, China",Video++ provides video-streaming services.,10,Active,2014-04-01,month
Kickstarter,https://www.crunchbase.com/organization/kickstarter,"Crowdfunding, Crowdsourcing, Finance, FinTech, Funding Platform","Brooklyn, New York, United States","Kickstarter is a crowdfunding platform for creative projects such as movies, music, art, theater, games, comics, design, and photography.",11,Active,2009-04-28,day
Lenovo,https://www.crunchbase.com/organization/lenovo,"Computer, Electronics, Hardware, Manufacturing, Mobile","Morrisville, North Carolina, United States",Lenovo Group is a Chinese multinational computer technology company.,12,Active,1984-01-01,year
SpaceX,https://www.crunchbase.com/organization/space-exploration-technologies,"Aerospace, Space Travel, Transportation","Hawthorne, California, United States","SpaceX is an aviation and aerospace company that designs, manufactures, and launches advanced rockets and spacecraft.",13,Active,2002-06-01,month
Apple,https://www.crunchbase.com/organization/apple,"Consumer Electronics, Electronics, Hardware, Retail","Cupertino, California, United States","Apple is a multinational corporation that designs, manufactures, and markets consumer electronics, personal computers, and software.",14,Active,1976-04-01,day
Facebook,https://www.crunchbase.com/organization/facebook,"Social, Social Media, Social Network","Menlo Park, California, United States",Facebook is an online social networking service that enables its users to connect with friends and family.,15,Active,2004-02-04,day
The New York Times,https://www.crunchbase.com/organization/newyorktimes,"Advertising, Internet, News, Publishing","New York, New York, United States","The New York Times creates, collects, and distributes news, information, and entertainment through a daily newspaper and a website.",16,Active,1851-09-18,day
Uber,https://www.crunchbase.com/organization/uber,"Customer Service, Mobile Apps, Public Transportation, Ride Sharing, Transportation","San Francisco, California, United States","Uber develops, markets, and operates a ride-sharing mobile application that allows consumers to submit a trip request.",17,Active,2009-03-01,month
Reddit,https://www.crunchbase.com/organization/reddit,"Content, News, Social Bookmarking, Social Media, Social Network","San Francisco, California, United States","Reddit is an online platform, enabling its users to submit links, create content, and have discussions about the topics of their interest.",18,Active,2005-01-01,year
"Blockchain, Inc.",https://www.crunchbase.com/organization/blockchain-info,"Bitcoin, Blockchain, Finance, FinTech, Web Development","London, England, United Kingdom","Blockchain is a web-based bitcoin platform that makes using bitcoin safe, easy, and secure for all consumers and businesses worldwide.",19,Active,2011-08-01,day
Tencent Holdings,https://www.crunchbase.com/organization/tencent,"Advertising, Internet, Mobile, Online Games, Social Media Marketing","Shenzhen, Guangdong, China","Tencent is a Chinese internet service portal offering value-added internet, mobile, telecom, and online advertising services.",20,Active,1998-11-01,day
Boston Scientific,https://www.crunchbase.com/organization/boston-scientific,"Health Care, Manufacturing, Medical, Medical Device","Marlborough, Massachusetts, United States",Boston Scientific is a leading innovator of medical solutions that improve the health of patients around the world.,21,Active,1979-01-01,year
Funding Circle,https://www.crunchbase.com/organization/funding-circle,"Finance, Financial Services, FinTech, Personal Finance","London, England, United Kingdom","Funding Circle is a lending platform focused exclusively on small businesses operating in in the U.S., the U.K. and Continental Europe.",22,Active,2010-08-13,day
LinkedIn,https://www.crunchbase.com/organization/linkedin,"Professional Networking, Professional Services, Recruiting, Social Media, Social Recruiting","Sunnyvale, California, United States","LinkedIn, a professional networking site, allows its members to create business connections, search for jobs, and find potential clients.",23,Active,2003-05-05,day
HelloFresh,https://www.crunchbase.com/organization/hellofresh,"Consumer, Cooking, Food and Beverage, Subscription Service","Berlin, Berlin, Germany",HelloFresh is a food subscription company that sends pre-portioned ingredients to users’ doorstep each week.,24,Active,2011-01-01,year
SurveyMonkey,https://www.crunchbase.com/organization/surveymonkey,"Human Resources, Market Research, Marketing, SaaS, Service Industry, Software","San Mateo, California, United States","SurveyMonkey, a leading global survey company, powers curious organizations to measure and act on the opinions that drive success.",25,Active,1999-01-01,year
MoviePass,https://www.crunchbase.com/organization/moviepass,"Apps, Media and Entertainment, Subscription Service","New York, New York, United States",MoviePass employs location-based technologies to allow individuals to watch movies at local theaters for a fixed monthly price.,26,Active,2011-02-01,day
Didi Chuxing,https://www.crunchbase.com/organization/didi-dache,"Mobile Apps, Public Transportation, Ride Sharing, Transportation","Beijing, Beijing, China","Didi Chuxing is a mobile transportation platform, offering a full range of commuting options to 400 cities in China.",27,Active,2012-09-01,day
BuzzFeed,https://www.crunchbase.com/organization/buzzfeed,"Digital Entertainment, Internet, Journalism, News, Publishing, Social, Social News, Video","New York, New York, United States",BuzzFeed is a cross-platform digital media company delivering news and entertainment content to a global audience.,28,Active,2006-01-01,year
Careem,https://www.crunchbase.com/organization/careem,"Customer Service, Logistics, Public Transportation, Ride Sharing, Transportation","Dubai, Dubai, United Arab Emirates",Careem develops an app that helps commuters in Dubai find cars for hire.,29,Active,2012-06-15,day
Rocket Internet,https://www.crunchbase.com/organization/rocket-internet,"Developer Platform, Internet, Software","Berlin, Berlin, Germany",Rocket Internet is an internet platform that identifies and builds proven internet business models.,30,Active,2007-01-01,year
Lime,https://www.crunchbase.com/organization/limebike,"Cycling, Last Mile Transportation, Mobile Apps, Ride Sharing, Transportation","San Mateo, California, United States",Lime helps people move around their cities in an affordable and convenient way while eliminating their carbon footprint.,31,Active,2017-06-01,month
Singapore Post,https://www.crunchbase.com/organization/singapore-post,"E-Commerce, Freight Service, Logistics, Retail, Supply Chain Management","Singapore, Central Region, Singapore","Singapore Post provides an integrated suite of mail, logistics and retail solutions in Singapore and the Asia Pacific region.",32,Active,1819-01-01,year
Nokia,https://www.crunchbase.com/organization/nokia,"Electronics, Enterprise Software, Infrastructure, Internet of Things, Mobile, Mobile Devices, Telecommunications, Wireless","Helsinki, Southern Finland, Finland","Nokia is a Finnish multinational communications corporation engaged in the manufacturing of mobile devices, and network infrastructure.",33,Active,1865-05-12,day
Dollar Shave Club,https://www.crunchbase.com/organization/dollar-shave-club,"E-Commerce, Internet, Retail","Santa Monica, California, United States","Dollar Shave Club makes and delivers everything you need to look, feel, and shave like a million bucks.",34,Active,2011-01-01,year
Palantir Technologies,https://www.crunchbase.com/organization/palantir-technologies,"Analytics, Computer, Information Technology, Software","Palo Alto, California, United States","Palantir Technologies offers a suite of software applications for integrating, visualizing, and analyzing information.",35,Active,2004-01-01,year
Indiegogo,https://www.crunchbase.com/organization/indie-gogo,"Crowdfunding, Finance, FinTech, Funding Platform, Hedge Funds","San Francisco, California, United States",Indiegogo is a global crowdfunding platform empowering people around the world to fund projects that matter to them.,36,Active,2008-01-14,day
HashiCorp,https://www.crunchbase.com/organization/hashicorp,"Cloud Infrastructure, Cyber Security, Private Cloud","San Francisco, California, United States","HashiCorp enables organizations to provision, secure, and run any infrastructure for any application.",37,Active,2012-01-01,year
Atlassian,https://www.crunchbase.com/organization/atlassian,"Collaboration, Developer Tools, Enterprise Software, Software","Sydney, New South Wales, Australia","Atlassian provides collaboration software for teams with products including JIRA, Confluence, HipChat, Bitbucket, and Stash.",38,Active,2002-01-01,year
BitGo,https://www.crunchbase.com/organization/bitgo,"Bitcoin, E-Commerce, Financial Services, Internet, Network Security","Palo Alto, California, United States",BitGo is a Bitcoin security platform and a pioneer of multi-sig technology.,39,Active,2013-01-01,year
Afiniti,https://www.crunchbase.com/organization/afiniti,"Analytics, Artificial Intelligence, Big Data, Customer Service, Enterprise Software","Washington, District of Columbia, United States",Afiniti provides artificial intelligence (AI) solutions that enable the transformation of enterprise profitability.,40,Active,2006-01-01,year
Cloudera,https://www.crunchbase.com/organization/cloudera,"Analytics, Big Data, Cloud Computing, Cloud Data Services, Cloud Infrastructure, Cloud Management, Enterprise Software, Machine Learning, Open Source","Palo Alto, California, United States",Cloudera delivers the modern platform for machine learning and analytics optimized for the cloud.,41,Active,2008-10-13,day
Deliv,https://www.crunchbase.com/organization/deliv,"Crowdsourcing, E-Commerce, Internet, Same Day Delivery","Menlo Park, California, United States",Deliv is a crowdsourced same-day delivery service for large national multichannel retailers.,42,Active,2012-01-01,year
Vacasa,https://www.crunchbase.com/organization/vacasa,"Adventure Travel, Tourism, Travel, Travel Accommodations, Vacation Rental","Portland, Oregon, United States","Vacasa is the largest U.S. vacation rental management company and currently manages more than 10,000 vacation homes around the world.",43,Active,2009-01-01,year
Business Insider,https://www.crunchbase.com/organization/business-insider,"Digital Media, News","New York, New York, United States","Business Insider is an online platform that offers the latest business, celebrity, and technology news across America.",44,Active,2007-05-01,day
Grin Scooters,https://www.crunchbase.com/organization/grin-scooters,"Electric Vehicle, Last Mile Transportation, Mobile, Ride Sharing, Transportation","Mexico City, Distrito Federal, Mexico",Grin Scooters is a software company that operates a network of  shared electric scooters.,45,Active,2018-04-30,day
Samsung Electronics,https://www.crunchbase.com/organization/samsung-electronics,"Electronics, Mobile Devices, Software","Suwon, Ch'ungch'ong-namdo, South Korea",Samsung Electronics is a South Korean multinational electronics company.,46,Active,1969-02-12,day
ByteDance,https://www.crunchbase.com/organization/bytedance,"Content, Data Mining, Internet, Machine Learning","Haidian, Beijing, China","Bytedance owns a series of content platforms that enable people to connect with, consume, and create content.",47,Active,2012-03-01,month
Hulu,https://www.crunchbase.com/organization/hulu,"Content, Film, TV, Video, Video Streaming","Los Angeles, California, United States","Hulu is an online video service that offers a selection of hit shows, clips, movies, and documentaries through its website. ",48,Active,2007-03-01,day
Square,https://www.crunchbase.com/organization/square,"Finance, FinTech, Hardware, Mobile, Mobile Payments, Payments, Software","San Francisco, California, United States",Square is a merchant services aggregator and mobile payment company that aims to simplify commerce through technology.,49,Active,2009-02-01,day
Lucid Motors,https://www.crunchbase.com/organization/atieva,"Automotive, Electric Vehicle, Software","Menlo Park, California, United States","Lucid Motors is a Silicon Valley company that designs, develops, and builds electric vehicles.",50,Active,2007-01-01,year
Knotel,https://www.crunchbase.com/organization/knotel,"Construction, Coworking, Interior Design, Real Estate","New York, New York, United States",Knotel transforms commercial real estate market with its Agile HQ™ Platform for businesses.,51,Active,2015-12-01,month
OmniSci,https://www.crunchbase.com/organization/omnisci,"Analytics, Big Data, Data Visualization","San Francisco, California, United States","OmniSci is the creator of the extreme analytics platform, used to find insights in big data beyond the limits of mainstream tools.",52,Active,2013-09-01,day
Amazon Pay,https://www.crunchbase.com/organization/amazon-payments,"E-Commerce, Internet, Mobile Payments, Online Portals, Payments","Seattle, Washington, United States",Amazon Pay makes it easy for millions of Amazon customers to pay using the information already stored in their Amazon account.,53,Active,2005-01-01,year
Compass,https://www.crunchbase.com/organization/compassinc,"E-Commerce Platforms, Local, Mobile, Property Management, Real Estate","New York, New York, United States","Compass is building the first modern real estate platform, pairing the industry’s top talent with technology.",54,Active,2012-10-04,day
Ginkgo Bioworks,https://www.crunchbase.com/organization/ginkgo-bioworks,"Alternative Medicine, Biopharma, Biotechnology, Health Care, Medical","Boston, Massachusetts, United States",Ginkgo designs custom microbes for customers across multiple markets.,55,Active,2009-01-01,year
Elastic,https://www.crunchbase.com/organization/elasticsearch,"Cloud Computing, Open Source, Real Time, Search Engine, Software","Mountain View, California, United States","Elastic builds software to make data usable in real time and at scale for search, logging, security, and analytics use cases.",56,Active,2012-02-01,day
Monzo,https://www.crunchbase.com/organization/mondo,"Banking, Finance, FinTech","London, England, United Kingdom",Monzo is a London-based digital-only bank platform.,57,Active,2015-02-01,month
IHS Markit,https://www.crunchbase.com/organization/ihs-markit,"Analytics, Big Data, Consulting, Information Services","London, England, United Kingdom",IHS provides information and analysis to support the decision-making process of businesses and governments in industries.,58,Active,1959-01-01,day
Deliveroo,https://www.crunchbase.com/organization/deliveroo,"Delivery, Food and Beverage, Restaurants, Same Day Delivery","London, England, United Kingdom","Deliveroo is a technology company that focuses on marketing, selling, and delivering restaurant meals to the household or office.",59,Active,2012-01-01,year
Klarna,https://www.crunchbase.com/organization/klarna,"Banking, E-Commerce, Finance, Financial Services, FinTech, Payments","Stockholm, Stockholms Lan, Sweden",Klarna provides e-commerce payment solutions for merchants and shoppers.,60,Active,2005-02-01,month
WhatsApp,https://www.crunchbase.com/organization/whatsapp,"Android, Messaging, Mobile, Subscription Service","Santa Clara, California, United States","WhatsApp is a proprietary, cross-platform, free instant messaging subscription service for smartphones.",61,Active,2009-01-01,year
Zume Pizza,https://www.crunchbase.com/organization/zume-pizza,"Consumer, Food and Beverage, Food Delivery","Mountain View, California, United States","Zume Pizza operates as a pizza delivery platform based in Mountain View, CA.",62,Active,2015-09-08,day
Qualtrics,https://www.crunchbase.com/organization/qualtrics,"Consumer, Market Research, SaaS","Provo, Utah, United States","Qualtrics is a single system of record for all experience data, managing customer, product, employee and brand experiences on one platform.",63,Active,2002-01-01,year
ShopRunner,https://www.crunchbase.com/organization/shoprunner,"E-Commerce, Electronics, Shopping","Chicago, Illinois, United States",ShopRunner is a members-only online shopping service that offers consumer-friendly and free shipping services.,64,Active,2010-01-01,year
Zomato,https://www.crunchbase.com/organization/zomato,"Food Delivery, Hospitality, Reservations, Restaurants, Search Engine","Gurgaon, Haryana, India",Zomato is a search app offering detailed information for restaurants as well as online food delivery.,65,Active,2008-07-10,day
BigBasket,https://www.crunchbase.com/organization/bigbasket-com,"Delivery Service, E-Commerce, Retail, Shopping","Bangalore, Karnataka, India",Bigbasket.com is an online food and grocery store.,66,Active,2011-10-01,day
TaskRabbit,https://www.crunchbase.com/organization/taskrabbit,"Apps, E-Commerce, Home Services, Location Based Services, Mobile, Peer to Peer, Sharing Economy","San Francisco, California, United States","TaskRabbit is a platform that matches up users with help on furniture assembly, moving, and other handyman services.",67,Active,2008-01-01,day
Twist Bioscience,https://www.crunchbase.com/organization/twist-biosciences,"Biotechnology, Chemical, Health Care","San Francisco, California, United States",Twist Bioscience Corp. is a synthetic DNA production for specialty chemical compounds and drug development.,68,Active,2013-01-01,year
Unity Technologies,https://www.crunchbase.com/organization/unity-technologies,"3D Technology, Advertising, Analytics, Augmented Reality, Automotive, Enterprise Software, Film, Video Games, Virtual Reality","San Francisco, California, United States",Unity is the creator the world’s most widely used real-time 3D development platform.,69,Active,2004-08-02,day
WhiteSource,https://www.crunchbase.com/organization/white-source,"Developer Tools, Enterprise Software, Open Source","New York, New York, United States",WhiteSource empowers businesses to develop better software by harnessing the power of open source.,70,Active,2011-01-01,year
Binance,https://www.crunchbase.com/organization/binance,"Bitcoin, Cryptocurrency, Ethereum, Finance, FinTech, Internet","Valletta, NA - Malta, Malta",Binance is a cryptocurrency exchange platform that combines digital technology and finance.,71,Active,2017-07-01,day
Walmart,https://www.crunchbase.com/organization/walmart,"E-Commerce, Internet, Mobile, Retail, Retail Technology","Bentonville, Arkansas, United States",Walmart is a multinational retail corporation that operates several chains of discount department and warehouse stores.,72,Active,1962-01-02,day
DoorDash,https://www.crunchbase.com/organization/doordash,"Delivery, Food Delivery, Local, Logistics, Mobile, Small and Medium Businesses","San Francisco, California, United States",DoorDash enables small businesses to provide its customers with local delivery services.,73,Active,2013-01-01,year
ATTN:,https://www.crunchbase.com/organization/attn-,"Digital Media, News, Social Media, Video","Los Angeles, California, United States",ATTN: is a content network that helps young people understand and impact the world around them.,74,Active,2014-06-01,day
Ople,https://www.crunchbase.com/organization/ople,"Artificial Intelligence, Machine Learning, SaaS, Software","San Mateo, California, United States","Ople uses artificial intelligence to build AI and has developed an AI platform that acts, thinks, and learns like a data scientist.",75,Active,2017-03-01,month
Domio,https://www.crunchbase.com/organization/domio-inc,"Big Data, Hospitality, Hotel, Internet, Marketplace, Property Management, Real Estate, SaaS, Sharing Economy, Travel","New York, New York, United States","Domio is a rapidly growing technology platform at the intersection of real estate, travel, and hospitality.",76,Active,2016-08-01,day
Devoted Health,https://www.crunchbase.com/organization/devoted-health,"Elder Care, Elderly, Health Care, Hospital","Waltham, Massachusetts, United States",Devoted Health is a healthcare company serving seniors and giving them a health care plan with personal guides and world-class technology.,77,Active,2017-03-01,month
AngelList,https://www.crunchbase.com/organization/angellist,"Angel Investment, Finance, Funding Platform, Internet","San Francisco, California, United States","AngelList is a U.S. website for startups, angel investors, and job-seekers looking to work at startups.",78,Active,2010-01-01,day
Darktrace,https://www.crunchbase.com/organization/darktrace,"Artificial Intelligence, Cyber Security, Information Technology, Machine Learning, Network Security","Cambridge, Cambridgeshire, United Kingdom",Darktrace is an artificial intelligence company for cyber security.,79,Active,2013-01-01,year
Apollo,https://www.crunchbase.com/organization/apollo-global-management-llc,"Credit, Financial Services, Real Estate","New York, New York, United States","Apollo Global Management specializes in credit-oriented capital, real estate markets, and is a global asset management firm.",80,Active,1990-01-01,year
Google,https://www.crunchbase.com/organization/google,"Ad Network, Artificial Intelligence, Blogging Platforms, Collaboration, Email, Enterprise Software, Information Technology, Machine Learning, Search Engine, Video Streaming","Mountain View, California, United States",Google is a multinational corporation that is specialized in internet-related services and products.,81,Active,1998-09-07,day
MongoDB,https://www.crunchbase.com/organization/mongodb-inc,"Cloud Computing, Database, Open Source, PaaS","New York, New York, United States",MongoDB is a next-generation database that helps businesses transform their industries by harnessing the power of data.,82,Active,2007-11-01,day
People.ai,https://www.crunchbase.com/organization/people-ai,"Artificial Intelligence, Intelligent Systems, Machine Learning, Predictive Analytics, Sales","San Francisco, California, United States","People is the AI platform for enterprise sales, marketing, and customer success that uncovers every revenue opportunity from every customer.",83,Active,2016-01-01,year
MedMen,https://www.crunchbase.com/organization/medmen,"Asset Management, Cannabis, Finance, Service Industry","Culver City, California, United States","MedMen owns and operates licensed cannabis facilities in cultivation, manufacturing and retail.",84,Active,2010-01-01,year
AllTrails,https://www.crunchbase.com/organization/alltrails-com,"Android, Fitness, iOS, Sports","San Francisco, California, United States","AllTrails is a community of 9 million hikers, campers and mountain bikers who share a passion about the outdoors.",85,Active,2010-01-01,year
Thread,https://www.crunchbase.com/organization/thread-com,"E-Commerce, Fashion, Internet, Machine Learning","London, England, United Kingdom",Thread connects users to online stylists to help them find the clothes they love. ,86,Active,2012-06-01,month
