Organization Name,Organization Name URL,Categories,Headquarters Location,Description,CB Rank (Company),Operating Status,Founded Date,Founded Date Precision
"PAX Labs, Inc.",https://www.crunchbase.com/organization/pax-labs,"Cannabis, Consumer Electronics, Personal Health","San Francisco, California, United States","PAX Labs, Inc., is a vaporizers and e-cigarettes manufacturer and supplier.",263,Active,2007-01-01,day
Cylance,https://www.crunchbase.com/organization/cylance,"Artificial Intelligence, Consulting, Cyber Security, Enterprise Software, Machine Learning, Network Security, Penetration Testing","Irvine, California, United States",Cylance is a global provider of cybersecurity products and services to solve security problems.,264,Active,2012-07-04,day
Blackbuck,https://www.crunchbase.com/organization/zinka-logistics,"Information Services, Internet, Logistics, Supply Chain Management, Transportation","Bengaluru, Karnataka, India",Blackbuck is a logistics startup based in India.,265,Active,2015-01-01,year
Silver Peak,https://www.crunchbase.com/organization/silver-peak,"Cloud Infrastructure, Infrastructure, Network Hardware, Software, Virtualization","Santa Clara, California, United States",Silver Peak is the Global Leader in Broadband and Hybrid WAN Solutions.,266,Active,2004-01-01,year
FreightWaves,https://www.crunchbase.com/organization/freightwaves,"Analytics, Financial Services, Freight Service, Logistics, Marketplace, Predictive Analytics, Railroad, Transportation","Chattanooga, Tennessee, United States",FreightWaves is a provider of data for the freight markets. ,267,Active,2016-06-01,day
Airobotics,https://www.crunchbase.com/organization/airobotics,"Aerospace, Drone Management, Drones, Internet of Things, Robotics","Petah Tiqva, HaMerkaz, Israel","Airobotics provides an end-to-end, fully automatic solution for collecting aerial data and gaining invaluable insights.",268,Active,2014-12-01,month
Patreon,https://www.crunchbase.com/organization/patreon,"Music, Podcast, Sponsorship, Video","San Francisco, California, United States",Patreon enables fans and sponsors to give ongoing support to artists and creators.,269,Active,2013-05-07,day
Zenefits,https://www.crunchbase.com/organization/zenefits,"Human Resources, SaaS, Software","San Francisco, California, United States","Zenefits delivers a complete, all-mobile HR experience for small and medium businesses.",270,Active,2013-06-17,day
SeedInvest,https://www.crunchbase.com/organization/seedinvest,"Association, Crowdfunding, Funding Platform, Venture Capital","New York, New York, United States",SeedInvest is an equity crowdfunding platform that connects investors with startups.,271,Active,2011-05-01,day
General Fusion,https://www.crunchbase.com/organization/general-fusion,"Energy, Environmental Engineering, Renewable Energy","Burnaby, British Columbia, Canada",General Fusion develops utility-scale fusion power using magnetized target fusion.,272,Active,2002-01-01,year
Truphone,https://www.crunchbase.com/organization/truphone,"Internet of Things, Mobile, Telecommunications","London, England, United Kingdom",Truphone is a global mobile network that provides customers with truly local service wherever they are.,273,Active,2006-07-01,day
AppZen,https://www.crunchbase.com/organization/appzen,"Accounting, Artificial Intelligence, Big Data, Enterprise Software, FinTech, SaaS","Santa Clara, California, United States",AppZen offers an artificial Intelligence powered SaaS solution for automating enterprise back office processes.,274,Active,2012-12-01,day
MGM Resorts International,https://www.crunchbase.com/organization/mgm-resorts-international,"Hospitality, Resorts","Las Vegas, Nevada, United States","MGM Resorts International is a hospitality firm that operates casinos, restaurants, and recreational resorts.",275,Active,2000-05-31,day
Softomotive,https://www.crunchbase.com/organization/softomotive,"Business Information Systems, Industrial Automation, Office Administration, Robotics, Software","London, England, United Kingdom",Softomotive is a software company that provides Robotic Process Automation technology for organizations's digital workforce development.,276,Active,2005-01-01,year
Keeps,https://www.crunchbase.com/organization/keeps,"Health Care, Men's, Pharmaceutical, Wellness","New York, New York, United States",Keeps is the easiest way to keep your hair.,277,Active,2017-01-01,year
AppNexus,https://www.crunchbase.com/organization/appnexus,"Ad Network, Advertising, Internet, Service Industry, Software","New York, New York, United States",AppNexus provides cloud-based advertising products and services.,278,Active,2007-09-01,month
Roblox,https://www.crunchbase.com/organization/roblox,"Developer Platform, Online Games, Online Portals, Video Games","San Mateo, California, United States",Roblox is an online entertainment platform that helps power the imaginations of people around the world.,279,Active,2004-01-01,year
Thrive Market,https://www.crunchbase.com/organization/thrive-market,"Beauty, E-Commerce, Health Care, Retail, Shopping","Los Angeles, California, United States","Thrive Market is an online retailer with over 2,500 high-quality healthy foods, vitamins, home goods, and beauty supplies.",280,Active,2013-01-01,year
Houghton Mifflin Harcourt,https://www.crunchbase.com/organization/houghton-mifflin-harcourt,"Content, EBooks, Education","Boston, Massachusetts, United States","Houghton Mifflin Harcourt is a global learning company specialized in pre-K–12 education content, services, and technology solutions.",281,Active,1832-01-01,year
8x8,https://www.crunchbase.com/organization/8x8-inc,"SaaS, Telecommunications, VoIP","San Jose, California, United States","8x8 offers secure and reliable cloud-based, enterprise-class business phone systems, unified communications, and contact center solutions.",282,Active,1987-01-01,year
Goldman Sachs,https://www.crunchbase.com/organization/goldman-sachs,"Banking, Finance, Financial Services, Security, Venture Capital","New York, New York, United States","Goldman Sachs is a multinational financial services firm providing securities, and investment banking and management services.",283,Active,1869-01-01,day
Blue Vision Labs,https://www.crunchbase.com/organization/blue-vision-labs,"Augmented Reality, Information Technology, Robotics","London, England, United Kingdom",Blue Vision Labs is a technology-focused company creating next-generation machine perception technology.,284,Active,,
Infor,https://www.crunchbase.com/organization/infor,"Cloud Data Services, Database, Enterprise Software, Information Technology, Software","New York, New York, United States",Infor provides enterprise software and services worldwide.,285,Active,2002-05-30,day
Birchbox,https://www.crunchbase.com/organization/birchbox,"Beauty, E-Commerce, E-Commerce Platforms, Internet","New York, New York, United States","Birchbox is a discovery commerce platform offering a personalized method for discovering, learning, and shopping for products in the market.",286,Active,2010-01-01,year
Affirm,https://www.crunchbase.com/organization/affirm,"Consumer Lending, Financial Services, FinTech, Payments, Personal Finance","San Francisco, California, United States",Affirm is a financial technology services company that offers installment loans to consumers at the point of sale.,287,Active,2012-01-01,year
DuckDuckGo,https://www.crunchbase.com/organization/duck-duck-go,"Internet, Privacy, Search Engine","Paoli, Pennsylvania, United States",DuckDuckGo is an internet search engine that protects web searchers’ privacy.,288,Active,2008-02-29,day
Vice Media,https://www.crunchbase.com/organization/vice,"Media and Entertainment, News, Publishing, Video, Video Streaming","Brooklyn, New York, United States",Vice Media is a North American digital media and broadcasting company.,289,Active,1994-01-01,year
Faraday Future,https://www.crunchbase.com/organization/faraday-future,"Automotive, Content, Electric Vehicle","Gardena, California, United States","Faraday Future, a design and technology company, develops global solutions that re-imagine transportation, content, and ownership.",290,Active,2014-04-01,month
Forward Health,https://www.crunchbase.com/organization/connected-healthcare,"Health Care, mHealth, Mobile Apps, Software, Software Engineering","London, England, United Kingdom","Forward Health is a secure mobile communication platform empowering health and care teams to work effectively, together.",291,Active,2016-01-01,year
Butterfly Network,https://www.crunchbase.com/organization/butterfly-network,"Electronics, Health Care, Medical Device, Personal Health, Software","Guilford, Connecticut, United States",Butterfly Network designs a medical imaging device that reduces the cost of real-time and three-dimensional imaging and treatment.,292,Active,2011-01-01,year
Petal,https://www.crunchbase.com/organization/petal,"Credit Cards, Financial Services, FinTech","New York, New York, United States","Petal  is a new kind of credit card company on a mission to make credit honest, simple, and accessible.",293,Active,2016-01-01,year
Zuora,https://www.crunchbase.com/organization/zuora,"Billing, Developer APIs, FinTech, Payments, SaaS","San Mateo, California, United States","Zuora allows businesses to quote, order, bill, recognize revenue, report, and automate the entire customer lifecycle from a single platform.",294,Active,2007-01-01,year
Alpaca,https://www.crunchbase.com/organization/alpacadb,"Developer APIs, Financial Services, FinTech, Trading Platform","San Mateo, California, United States",Commission free API stock broker for algos & bots,295,Active,2015-02-18,day
Taboola,https://www.crunchbase.com/organization/taboola,"Advertising, Content, Content Discovery, Video","New York, New York, United States",Taboola is a content discovery platform that connects people with content they may like but never knew existed.,296,Active,2007-01-01,year
McLarens,https://www.crunchbase.com/organization/mclarens,"Insurance, Risk Management, Service Industry","Norcross, Georgia, United States","McLarens performs claims management, loss adjusting, pre-risk and damage surveying,",297,Active,2004-01-01,year
Hilton Worldwide,https://www.crunchbase.com/organization/hilton-worldwide,"Hospitality, Leisure, Resorts","Watford, Hertford, United Kingdom","Hilton Worldwide, a hospitality company, owns luxury and full-service hotels and resorts, extended-stay suites, and focused-service hotels.",298,Active,1919-01-01,year
Coinbase,https://www.crunchbase.com/organization/coinbase,"Bitcoin, Blockchain, Cryptocurrency, E-Commerce, Ethereum, FinTech, Personal Finance, Virtual Currency","San Francisco, California, United States",Coinbase is a digital currency wallet service that allows traders to buy and sell bitcoin.,299,Active,2012-06-01,day
American Well,https://www.crunchbase.com/organization/american-well,"Biotechnology, Health Care, Information Technology","Boston, Massachusetts, United States",American Well is an IT company that connects users instantly with doctors over video feed.,300,Active,2006-01-01,year
iQiyi,https://www.crunchbase.com/organization/iqiyi,"Content, Media and Entertainment, TV","Beijing, Beijing, China","iQiyi is a Chinese ad-supported television and movie portal providing fully-licensed, high-definition media content.",301,Active,2010-04-22,day
Starship Technologies,https://www.crunchbase.com/organization/starship-technologies,"Artificial Intelligence, Delivery Service, Food Delivery, Robotics, Transportation","San Francisco, California, United States",Starship Technologies develops self-driving delivery robots.,302,Active,2014-07-01,day
OpenSignal,https://www.crunchbase.com/organization/opensignalmaps,"Apps, Artificial Intelligence, Mobile, Wireless","London, England, United Kingdom",OpenSignal provides a mobile application that crowd-sources data on the performance and coverage of wireless networks around the world.,303,Active,2010-01-01,year
Wish,https://www.crunchbase.com/organization/wish,"Computer, Content Discovery, E-Commerce, Machine Learning, Mobile, Software","San Francisco, California, United States","Wish gives everyone access to the most affordable, convenient, and effective shopping mall and affordable goods.",304,Active,2010-01-01,year
Paytm,https://www.crunchbase.com/organization/paytm,"E-Commerce, Finance, Internet, Marketplace, Mobile Apps, Mobile Payments","Noida, Uttar Pradesh, India",Paytm is an Indian electronic payment and e-commerce brand based out of Delhi NCR.,305,Active,2010-01-01,day
Dish Network,https://www.crunchbase.com/organization/dish-network,"Audio, Consumer Electronics, Telecommunications","Englewood, Colorado, United States","Dish Network is a satellite service provider that offers satellite television, audio programming, and interactive television services.",306,Active,1980-01-01,year
Loadsmart,https://www.crunchbase.com/organization/loadsmart,"Logistics, Supply Chain Management, Transportation","New York, New York, United States",Loadsmart helps shippers move their freight fast and carriers keep trucks full.,307,Active,2014-01-01,year
TIER Mobility,https://www.crunchbase.com/organization/tier-mobility,"Electric Vehicle, Internet, Public Transportation, Recreational Vehicles, Rental, Ride Sharing, Transportation, Travel","Berlin, Berlin, Germany",TIER Mobility provides electric scooters that can be rented on demand to travel the last mile in cities.,308,Active,2018-01-01,year
Unacademy,https://www.crunchbase.com/organization/unacademy,"E-Learning, Education, Internet","Bangalore, Karnataka, India",Unacademy builds educational repository by empowering great educators and making it accessible to everyone.,309,Active,2015-01-01,year
Planet,https://www.crunchbase.com/organization/planet-labs,"Aerospace, Analytics, Big Data, Geospatial","San Francisco, California, United States",Planet builds small satellites and delivers information about the changing planet.,310,Active,2010-12-24,day
TransUnion,https://www.crunchbase.com/organization/transunion,"Credit Bureau, Information Technology, Legal","Chicago, Illinois, United States","Total credit protection all in one place from credit alerts, credit reports and credit scores.",311,Active,1968-01-01,year
Airtable,https://www.crunchbase.com/organization/airtable,"Collaboration, Database, Product Management, Task Management","San Francisco, California, United States",The most flexible collaboration platform,312,Active,2013-01-01,year
Concord,https://www.crunchbase.com/organization/concord-5,"Contact Management, Data Storage, Document Management, Enterprise Software","San Francisco, California, United States",Concord is the only contract management platform that enables companies to accelerate growth while maintaining flawless compliance.,313,Active,2014-01-01,year
LetsTransport,https://www.crunchbase.com/organization/letstransport,"Logistics, Transportation, Travel","Bangalore, Karnataka, India",Lets transport is a “Last mile” logistics solution provider.,314,Active,2015-01-01,year
Zendesk,https://www.crunchbase.com/organization/zendesk,"Customer Service, Enterprise Software, SaaS","San Francisco, California, United States",Zendesk is a customer service platform that builds software to empower organization and customer relationships.,315,Active,2007-10-05,day
Loggi,https://www.crunchbase.com/organization/loggi,"Logistics, Same Day Delivery","São Paulo, Sao Paulo, Brazil","Loggi is connecting Brazil, re-inventing logistics with technology, creating an Amazon for deliveries.",316,Active,2013-06-20,day
Ribbon,https://www.crunchbase.com/organization/ribbon-f326,"Financial Services, FinTech, Real Estate Investment","New York, New York, United States","Ribbon is a fintech company that transforms real estate transaction by delivering certainty, transparency, and joy to home buying.",317,Active,2017-09-01,month
The Athletic,https://www.crunchbase.com/organization/the-athletic,"Journalism, News, Sports","San Francisco, California, United States","The Athletic is a subscription-based sports media publisher with smart, in-depth sports coverage in 15+ US and Canadian markets.",318,Active,2015-11-06,day
Perfecto Mobile,https://www.crunchbase.com/organization/perfecto-mobile,"Cloud Computing, Mobile, Mobile Apps, Test and Measurement","Burlington, Massachusetts, United States",Perfecto is a software system helping users strengthen their digital interaction with quality-first approach to create web and native apps.,319,Active,2006-01-01,year
Aurora,https://www.crunchbase.com/organization/aurora-6292,"Automotive, Autonomous Vehicles, Marine Transportation, Transportation","Palo Alto, California, United States",Aurora is a self-driving vehicle company.,320,Active,2016-01-01,year
Netmeds,https://www.crunchbase.com/organization/netmeds-com,"Biotechnology, Health Care, Pharmaceutical","Chennai, Tamil Nadu, India",Welcome to India's most convenient pharmacy!,321,Active,2010-01-01,year
Lucid Software Inc,https://www.crunchbase.com/organization/lucidchart,"Collaboration, Enterprise Software, Internet","South Jordan, Utah, United States",Lucid Software is focused on building graphical web applications that push the boundaries of what's possible in the browser.,322,Active,2010-02-01,day
BrewDog,https://www.crunchbase.com/organization/brewdog,"Brewing, Food and Beverage, Service Industry, Wine And Spirits","Ellon, Aberdeenshire, United Kingdom",BrewDog is a craft beer brewery that produces bottled and canned beers in a variety of styles.,323,Active,2007-04-01,day
omni:us,https://www.crunchbase.com/organization/omnius,"Artificial Intelligence, Insurance, InsurTech, Machine Learning","Berlin, Berlin, Germany",omni:us delivers structured data from highly variable documents to streamline insurance back end processes.,324,Active,2015-01-01,year
AddThis,https://www.crunchbase.com/organization/addthis,"Big Data, File Sharing, Internet, Marketing, Mobile, Social Media","Vienna, Virginia, United States","AddThis provides social engagement tools, APIs and services personalizing websites for engagement, monetization and traffic boosting.",325,Active,2004-01-01,year
Trusted Insight,https://www.crunchbase.com/organization/trusted-insight,"Artificial Intelligence, Finance, FinTech, Hedge Funds, Machine Learning, Private Social Networking, Venture Capital","New York, New York, United States",Trusted Insight is the leading Institutional Syndication Platform for Alternative Assets. Its members manage over $18 Trillion in AUM.,326,Active,2010-01-01,year
Malwarebytes,https://www.crunchbase.com/organization/malwarebytes,"Computer, Enterprise Software, Security, Software","Santa Clara, California, United States","Cybersecurity solution that protects people and businesses against dangerous threats such as malware, ransomware, and exploits",327,Active,2008-01-21,day
Freightos,https://www.crunchbase.com/organization/freightos,"B2B, Logistics, Shipping, Supply Chain Management, Transportation","Hong Kong, Hong Kong Island, Hong Kong",Freightos makes global trade frictionless with an online freight marketplace and powerful international freight routing/pricing technology.,328,Active,2012-01-01,year
Snyk,https://www.crunchbase.com/organization/snyk,"Developer Tools, Network Security, Security","London, England, United Kingdom",Snyk is a network security company that helps developers use open source code and stay secure.,329,Active,2015-07-07,day
Pymetrics,https://www.crunchbase.com/organization/pymetrics,"Artificial Intelligence, Intelligent Systems, Neuroscience, Recruiting, Staffing Agency","New York, New York, United States",Pymetrics develops neuroscience-based assessment and prediction technology for staffing services.,330,Active,2013-09-01,month
Kony,https://www.crunchbase.com/organization/kony,"Android, E-Commerce, Enterprise Software, FinTech, iOS, Manufacturing, Mobile, Mobile Apps","Orlando, Florida, United States",Kony is a mobile application development platform (MADP) provider enabling companies to deliver innovative mobile solutions.,331,Active,2007-01-01,year
CryptoKitties,https://www.crunchbase.com/organization/cryptokitties,"Blockchain, Cryptocurrency, Internet, Mobile Apps, Online Games","Vancouver, British Columbia, Canada",CryptoKitties is a game that enables users to collect and breed virtual cats on the blockchain.,332,Active,2017-06-12,day
CenturyLink,https://www.crunchbase.com/organization/centurylink,"Big Data, Telecommunications, VoIP","Monroe, Louisiana, United States","CenturyLink is a telecommunications company providing broadband, voice and wireless services to consumers and businesses.",333,Active,1930-01-01,day
Sage Intacct,https://www.crunchbase.com/organization/sage-intacct,"Accounting, Cloud Computing, Enterprise Software, Finance, SaaS, Software","San Jose, California, United States",Sage Intacct is a financial management software.,334,Active,1999-01-01,year
Marketo,https://www.crunchbase.com/organization/marketo,"Ad Targeting, Analytics, Brand Marketing, Enterprise Software, Lead Management, Marketing Automation","San Mateo, California, United States","Marketo develops marketing automation software that provides inbound marketing, social marketing, CRM, and other related services.",335,Active,2006-02-10,day
ONE Championship,https://www.crunchbase.com/organization/one-championship,"Broadcasting, Media and Entertainment, News, Sports","Singapore, Central Region, Singapore",ONE Championship is a sports media company.,336,Active,,
Squarespace,https://www.crunchbase.com/organization/squarespace,"Blogging Platforms, Content, Internet, SaaS, Software, Web Design","New York, New York, United States","Squarespace is a SaaS-based content management system offering a website builder, blogging platform, and hosting service.",337,Active,2003-04-01,month
GrubHub,https://www.crunchbase.com/organization/grubhub,"Food Delivery, Hospitality, Restaurants","Chicago, Illinois, United States","GrubHub allows users to find and order food from restaurants in their vicinity that deliver or offer pickup, via an app and a website.",338,Active,2004-01-01,year
Dash Radio,https://www.crunchbase.com/organization/dash-radio-inc,"Broadcasting, Digital Media, Music","Los Angeles, California, United States",Dash Radio is an all original radio broadcaster for the digital world.,339,Active,2015-06-15,day
Foodpanda,https://www.crunchbase.com/organization/foodpanda,"Delivery, Food Delivery, Internet, Mobile Apps","Berlin, Berlin, Germany","foodpanda, a global online food delivery marketplace, enables users to place orders at local restaurants via its website or mobile app.",340,Active,2012-04-01,day
Moka,https://www.crunchbase.com/organization/moka,"FinTech, Mobile Payments, Point of Sale, Small and Medium Businesses","Jakarta, Jakarta Raya, Indonesia",Moka is an Indonesian fintech startup that focuses on building mobile point-of-sale (mPOS) for small and medium businesses.,341,Active,2014-07-01,day
GW Pharmaceuticals,https://www.crunchbase.com/organization/gw-pharmaceuticals,"Biotechnology, Pharmaceutical, Therapeutics","Histon, Cambridgeshire, United Kingdom","GW Pharmaceuticals was founded in 1998 and is listed on both the NASDAQ Global Market (GWPH) and AIM, a market of the London Stock",342,Active,1998-01-01,year
Anheuser-Busch InBev,https://www.crunchbase.com/organization/anheuser-busch,"Brewing, Consumer Goods, Food and Beverage","New York, New York, United States",Anheuser-Busch InBev is a brewer and provider of consumer products.,343,Active,1952-01-01,year
Tesco,https://www.crunchbase.com/organization/tesco,"Food Delivery, Retail, Shopping","Cheshunt, Herefordshire, United Kingdom","Tesco PLC is a British multinational grocery and general merchandise retailer headquartered in Cheshunt, Hertfordshire, England.",344,Active,1919-01-01,year
AND Global Pte.Ltd,https://www.crunchbase.com/organization/and-global-and-systems,"Artificial Intelligence, Finance, FinTech, Lending","Singapore, Central Region, Singapore",AND GLOBAL Pte.Ltd is a Singapore based True FinTech Company powered by Machine Learning and Brilliant Minds. ,345,Active,2015-05-24,day
Headspace,https://www.crunchbase.com/organization/headspace,"Events, Fitness, Health Care, Mobile Apps, Wellness","Santa Monica, California, United States","Headspace is a digital health platform, providing guided meditation sessions and mindfulness training.",346,Active,2010-01-01,year
Johns Hopkins University,https://www.crunchbase.com/organization/johns-hopkins-university,"EdTech, Education, Health Care, Higher Education, Social Entrepreneurship, Universities","Baltimore, Maryland, United States","Johns Hopkins University is a private research university based in Baltimore, Maryland.",347,Active,1876-01-01,year
Slice Labs,https://www.crunchbase.com/organization/slice-labs,"FinTech, Information Technology, Insurance, InsurTech, Mobile Apps","New York, New York, United States",Slice Labs is an insurance technology that provides an on-demand pay-per-use insurance for the on-demand economy.,348,Active,2015-10-01,month
MasterClass,https://www.crunchbase.com/organization/masterclass,"Digital Media, Education, Internet","San Francisco, California, United States",MasterClass is a premier online education platform redefining the digital learning experience.,349,Active,2012-01-01,year
Chime,https://www.crunchbase.com/organization/chime-2,"Banking, Debit Cards, E-Commerce, FinTech, Mobile Payments","San Francisco, California, United States","Chime helps members avoid bank fees, save money automatically, and lead healthier financial lives.",350,Active,2013-01-01,year
Sysdig,https://www.crunchbase.com/organization/sysdig,"Cloud Computing, Cloud Security, Internet, Open Source, Software","San Francisco, California, United States","The Cloud Native Intelligence Company - a unified platform to secure, monitor, and troubleshoot your containerized environment",351,Active,2013-01-01,year
