Company,Link,Pitch,Joined,Location,Market,Website,Employees,Stage,Total_raised
Octavian Ventures,https://angel.co/octavian-ventures,Seed capital Angel Fund,Dec ’13,Las Vegas,Pre Seed,octavianventures.com,1-10,Series A,"$15,000,000"
ShopLocket,https://angel.co/shoplocket,The easiest way to start collecting pre-orders.,Feb ’12,Toronto,Mobile Commerce,shoplocket.com,11-50,Acquired,"$1,000,000"
Minbox,https://angel.co/minbox,Changing the way you work,Mar ’12,San Francisco,File Sharing,minbox.com,1-10,Seed,-
Metail,https://angel.co/metail,Virtual fittingroom technology for fashion retailers,Feb ’12,London,Retail Technology,metail.com,11-50,,"$24,886,349"
Wanderable,https://angel.co/wanderable,Register for adventure. Live for love. ,May ’12,Redwood City,Weddings,wanderable.com,1-10,Acquired,-
